<?xml version="1.0" encoding="UTF-8"?>
<dataroot xmlns:od="urn:schemas-microsoft-com:officedata" xmlns:xsi="http://www.w3.org/2001/XMLSchema-instance"  xsi:noNamespaceSchemaLocation="tch_register.xsd" generated="2019-09-12T22:09:45">
<tch_register>
<user_id>1</user_id>
<tch_email>wattanapccp@gmail.com</tch_email>
<tch_firstname>วัฒนะ</tch_firstname>
<tch_lastname>รัมมะเอ็ด</tch_lastname>
<tch_phone>081-584-3168</tch_phone>
<tch_username>wattana</tch_username>
<tch_password>watachiwa2525</tch_password>
<flag>2</flag>
</tch_register>
<tch_register>
<user_id>2</user_id>
<tch_email>j.sungprasert@gmail.com</tch_email>
<tch_firstname>เจษฎา</tch_firstname>
<tch_lastname>สังข์ประเสริฐ</tch_lastname>
<tch_phone>080-260-5530</tch_phone>
<tch_username>freedomboy</tch_username>
<tch_password>15022528</tch_password>
<flag>2</flag>
</tch_register>
<tch_register>
<user_id>3</user_id>
<tch_email>Karnrapeenatchar2@hotmail.com</tch_email>
<tch_firstname>กานต์รพีณัชชาช์</tch_firstname>
<tch_lastname>ชัยปัญญา</tch_lastname>
<tch_phone>089-422-3228</tch_phone>
<tch_username>Karnrapeenatchar</tch_username>
<tch_password>0894223228</tch_password>
<flag>2</flag>
</tch_register>
<tch_register>
<user_id>4</user_id>
<tch_email>pcc2534@gmail.com</tch_email>
<tch_firstname>พัณณิตา</tch_firstname>
<tch_lastname>หนุนอนันต์</tch_lastname>
<tch_phone>086-964-1674</tch_phone>
<tch_username>Pannita</tch_username>
<tch_password>Psu5320</tch_password>
<flag>2</flag>
</tch_register>
<tch_register>
<user_id>5</user_id>
<tch_email>sukanya_maple@hotmail.com</tch_email>
<tch_firstname>สุกัญญา</tch_firstname>
<tch_lastname>กล่อมเกลี้ยง</tch_lastname>
<tch_phone>089-964-4285</tch_phone>
<tch_username>sukanya</tch_username>
<tch_password>maplemaster</tch_password>
<flag>2</flag>
</tch_register>
<tch_register>
<user_id>6</user_id>
<tch_email>suwisetwannaporn@gmail.com</tch_email>
<tch_firstname>วรรณพร</tch_firstname>
<tch_lastname>สุวิเศษ</tch_lastname>
<tch_phone>092-274-2781</tch_phone>
<tch_username>WannapornSuwiset</tch_username>
<tch_password>Praewohho19199</tch_password>
<flag>2</flag>
</tch_register>
<tch_register>
<user_id>7</user_id>
<tch_email>chitpong-pai@hotmail.com</tch_email>
<tch_firstname>ชิตพงษ์</tch_firstname>
<tch_lastname>เหนือเกาะหวาย</tch_lastname>
<tch_phone>089-605-4019</tch_phone>
<tch_username>chitpong</tch_username>
<tch_password>pai100435</tch_password>
<flag>2</flag>
</tch_register>
<tch_register>
<user_id>8</user_id>
<tch_email>kwarinat@gmail.com</tch_email>
<tch_firstname>วารินาถ</tch_firstname>
<tch_lastname>โขพิมาย</tch_lastname>
<tch_phone>063-449-8951</tch_phone>
<tch_username>Warinat</tch_username>
<tch_password>Kem27092532</tch_password>
<flag>2</flag>
</tch_register>
<tch_register>
<user_id>9</user_id>
<tch_email>srisunan2513@hotmail.com</tch_email>
<tch_firstname>ศรีสุนันท์</tch_firstname>
<tch_lastname>ประดิษฐ์</tch_lastname>
<tch_phone>081-786-0951</tch_phone>
<tch_username>Srisunan</tch_username>
<tch_password>Sri6760</tch_password>
<flag>2</flag>
</tch_register>
<tch_register>
<user_id>10</user_id>
<tch_email>petcharee22@hotmail.com</tch_email>
<tch_firstname>เพชรชรี</tch_firstname>
<tch_lastname>รักษาศรี</tch_lastname>
<tch_phone>081-803-5891</tch_phone>
<tch_username>petcharee</tch_username>
<tch_password>petcharee7881</tch_password>
<flag>2</flag>
</tch_register>
<tch_register>
<user_id>11</user_id>
<tch_email>wa.boonlue@gmail.com</tch_email>
<tch_firstname>วารีย์</tch_firstname>
<tch_lastname>บุญลือ</tch_lastname>
<tch_phone>081-810-4911</tch_phone>
<tch_username>Waree</tch_username>
<tch_password>waree339</tch_password>
<flag>2</flag>
</tch_register>
<tch_register>
<user_id>12</user_id>
<tch_email>krupalin.ch@gmail.com</tch_email>
<tch_firstname>ปาลิน</tch_firstname>
<tch_lastname>เห่งพุ่ม</tch_lastname>
<tch_phone>092-275-0401</tch_phone>
<tch_username>krupalin</tch_username>
<tch_password>krupalin123</tch_password>
<flag>2</flag>
</tch_register>
<tch_register>
<user_id>13</user_id>
<tch_email>khanittha_simma@outlook.com</tch_email>
<tch_firstname>ขนิษฐา</tch_firstname>
<tch_lastname>สิมมา</tch_lastname>
<tch_phone>062-124-5257</tch_phone>
<tch_username>Khanitha</tch_username>
<tch_password>botan</tch_password>
<flag>2</flag>
</tch_register>
<tch_register>
<user_id>14</user_id>
<tch_email>ajvee_math@hotmail.com</tch_email>
<tch_firstname>ฉวีวรรณ</tch_firstname>
<tch_lastname>อรุณถาวรณ์</tch_lastname>
<tch_phone>087-514-5940</tch_phone>
<tch_username>Chaweewan </tch_username>
<tch_password>kruvee6518</tch_password>
<flag>2</flag>
</tch_register>
<tch_register>
<user_id>15</user_id>
<tch_email>teacher_tong@hotmail.com</tch_email>
<tch_firstname>ศุภนันทา</tch_firstname>
<tch_lastname>บัวรัตนกาญจน์</tch_lastname>
<tch_phone>081-730-9306</tch_phone>
<tch_username>suphananta</tch_username>
<tch_password>tong8565</tch_password>
<flag>2</flag>
</tch_register>
<tch_register>
<user_id>16</user_id>
<tch_email>tussy4291@gmail.com</tch_email>
<tch_firstname>ทัศนีย์</tch_firstname>
<tch_lastname>จันทิวาสน์</tch_lastname>
<tch_phone>085-169-4291</tch_phone>
<tch_username>Tussanee</tch_username>
<tch_password>998877</tch_password>
<flag>2</flag>
</tch_register>
<tch_register>
<user_id>17</user_id>
<tch_email>mayzaa7916@gmail.com</tch_email>
<tch_firstname>วรางคณา</tch_firstname>
<tch_lastname>ธุภักดี</tch_lastname>
<tch_phone>090-249-8795</tch_phone>
<tch_username>Warangkhana.T</tch_username>
<tch_password>Maywarang 16</tch_password>
<flag>2</flag>
</tch_register>
<tch_register>
<user_id>18</user_id>
<tch_email>jongrak.niamsawan@gmail.com</tch_email>
<tch_firstname>จงรักษ์</tch_firstname>
<tch_lastname>เนียมสวรรค์</tch_lastname>
<tch_phone>089-461-8119</tch_phone>
<tch_username>jongrak</tch_username>
<tch_password>golf123</tch_password>
<flag>2</flag>
</tch_register>
<tch_register>
<user_id>19</user_id>
<tch_email>timsa2526@hotmail.com</tch_email>
<tch_firstname>ทิชากร</tch_firstname>
<tch_lastname>สัตย์จริง</tch_lastname>
<tch_phone>086-079-5386</tch_phone>
<tch_username>Ticha</tch_username>
<tch_password>temo252</tch_password>
<flag>2</flag>
</tch_register>
<tch_register>
<user_id>20</user_id>
<tch_email>su_nan_jung@hotmail.com</tch_email>
<tch_firstname>สุนันท์</tch_firstname>
<tch_lastname>แสดขุนทด</tch_lastname>
<tch_phone>086-369-9637</tch_phone>
<tch_username>Sunan</tch_username>
<tch_password>Nnaann1379</tch_password>
<flag>2</flag>
</tch_register>
<tch_register>
<user_id>21</user_id>
<tch_email>krudang0443@gmail.com</tch_email>
<tch_firstname>นพวรรณ</tch_firstname>
<tch_lastname>จันตะคุ</tch_lastname>
<tch_phone>089-058-7772</tch_phone>
<tch_username>Noppawun</tch_username>
<tch_password>Dang2504</tch_password>
<flag>2</flag>
</tch_register>
<tch_register>
<user_id>22</user_id>
<tch_email>buu_np@hotmail.com</tch_email>
<tch_firstname>พรพรรณ</tch_firstname>
<tch_lastname>โฉมวงษ์</tch_lastname>
<tch_phone>064-419-1593</tch_phone>
<tch_username>Pornpan.Nam</tch_username>
<tch_password>Nam1891</tch_password>
<flag>2</flag>
</tch_register>
<tch_register>
<user_id>23</user_id>
<tch_email>aumaimpccp@gmail.com</tch_email>
<tch_firstname>กัญญาภัค</tch_firstname>
<tch_lastname>ชมภูคำ</tch_lastname>
<tch_phone>094-615-9164</tch_phone>
<tch_username>Aumaimpccp</tch_username>
<tch_password>Qazwsxedc1234</tch_password>
<flag>2</flag>
</tch_register>
<tch_register>
<user_id>24</user_id>
<tch_email>nichakarn.tong@gmail.com</tch_email>
<tch_firstname>ณิชต์ชกาญจน์</tch_firstname>
<tch_lastname>อุทุมสกุลรัตน์</tch_lastname>
<tch_phone>099-351-5663</tch_phone>
<tch_username>Nichakarn</tch_username>
<tch_password>nicha2555</tch_password>
<flag>2</flag>
</tch_register>
<tch_register>
<user_id>25</user_id>
<tch_email>pang.sunitda@gmail.com</tch_email>
<tch_firstname>สุนิตดา</tch_firstname>
<tch_lastname>กล่อมแสง</tch_lastname>
<tch_phone>081-918-8214</tch_phone>
<tch_username>Sunitda</tch_username>
<tch_password>pang8214</tch_password>
<flag>2</flag>
</tch_register>
<tch_register>
<user_id>26</user_id>
<tch_email>pla.taweeporn@gmail.com</tch_email>
<tch_firstname>ทวีพร</tch_firstname>
<tch_lastname>ผดุงสงฆ์</tch_lastname>
<tch_phone>086-828-3420  </tch_phone>
<tch_username>Taweeporn</tch_username>
<tch_password>Pla.2025</tch_password>
<flag>2</flag>
</tch_register>
<tch_register>
<user_id>27</user_id>
<tch_email>nittayajuytoei@gmail.com</tch_email>
<tch_firstname>นิตยา</tch_firstname>
<tch_lastname>จุ้ยเตย</tch_lastname>
<tch_phone>087-108-4366</tch_phone>
<tch_username>NittayaJuy</tch_username>
<tch_password>NittayaJuy</tch_password>
<flag>2</flag>
</tch_register>
<tch_register>
<user_id>28</user_id>
<tch_email>fannapa@gmail.com</tch_email>
<tch_firstname>นทิตา </tch_firstname>
<tch_lastname>สุทะปัญญา</tch_lastname>
<tch_phone>092-360-9175</tch_phone>
<tch_username>Natita </tch_username>
<tch_password>Natita 30</tch_password>
<flag>2</flag>
</tch_register>
<tch_register>
<user_id>29</user_id>
<tch_email>aj_berry@hotmail.com</tch_email>
<tch_firstname>รัชนี </tch_firstname>
<tch_lastname>สิงหะนาม</tch_lastname>
<tch_phone>089-206-4703</tch_phone>
<tch_username>Ratchanee</tch_username>
<tch_password>Singhanam2525</tch_password>
<flag>2</flag>
</tch_register>
<tch_register>
<user_id>30</user_id>
<tch_email>jeeraporn@g.dlit.ac.th</tch_email>
<tch_firstname>จีรพร</tch_firstname>
<tch_lastname>ทองเวียง</tch_lastname>
<tch_phone>081-929-7209</tch_phone>
<tch_username>Jeeraporn</tch_username>
<tch_password>Jeeraporn99</tch_password>
<flag>2</flag>
</tch_register>
<tch_register>
<user_id>31</user_id>
<tch_email>narongritmsc@hotmail.com</tch_email>
<tch_firstname>ณรงค์ฤทธิ์</tch_firstname>
<tch_lastname>แมนสืบชาติ</tch_lastname>
<tch_phone>084-828-2526</tch_phone>
<tch_username>narongrit</tch_username>
<tch_password>0848282526</tch_password>
<flag>2</flag>
</tch_register>
<tch_register>
<user_id>32</user_id>
<tch_email>sirinho.24@gmail.com</tch_email>
<tch_firstname>ศิริชัย</tch_firstname>
<tch_lastname>สงวนสิทธิอนันต์</tch_lastname>
<tch_phone>086-556-2082</tch_phone>
<tch_username>Sirichai</tch_username>
<tch_password>Siri2524</tch_password>